{
  "$schema": "https://json-schema.org/draft/2020-12/schema",
  "type": "object",
  "required": [
    "schema_version",
    "version",
    "status",
    "engine_output_may_create_truth",
    "cases"
  ],
  "properties": {
    "schema_version": {
      "const": "architecture-golden-matrix/1.0"
    },
    "version": {
      "type": "string"
    },
    "status": {
      "type": "string"
    },
    "engine_output_may_create_truth": {
      "const": false
    },
    "cases": {
      "type": "array",
      "minItems": 8,
      "maxItems": 8,
      "items": {
        "type": "object"
      }
    }
  },
  "additionalProperties": false
}
